{
  "valid": false,
  "error_count": 1,
  "warning_count": 1,
  "issue_count": 2,
  "issues": [
    {
      "code": "invalid_path",
      "severity": "error",
      "path": "constraints[0].path",
      "message": "Constraint path PID.X is not a valid HL7 field path."
    },
    {
      "code": "unknown_table_reference",
      "severity": "warning",
      "path": "constraints[1].table",
      "message": "Table 9999 is not present in the loaded profile tables."
    }
  ]
}
